{
  "schemaVersion": 2,
  "package": { "name": "示例：自定义 COC 规则", "version": "1.0.0", "authors": ["木落"], "license": "Apache-2.0", "description": "注册 index 20、key 为“测试”的自定义 COC 检定规则。", "homepage": "https://github.com/sealdice/javascript" },
  "build": { "entry": "src/index.ts", "ecmaTarget": "es6", "bundleFileName": "012-custom-coc-rule.js" },
  "sealDice": { "buildTarget": ["1.6.0"], "defaultTarget": "1.6.0" },
  "release": { "directory": "release", "checksum": "sha256", "artifactPolicy": { "forbiddenPaths": [], "forbiddenExtensions": [] } },
  "sealpack": {
    "packageId": "sealdice-js-examples/012-custom-coc-rule", "minSealDice": "1.6.0", "contents": { "scripts": { "bundle": true, "path": "scripts/012-custom-coc-rule.js" } }, "dependencies": {},
    "permissions": { "network": false, "networkHosts": [], "acknowledgeUnrestrictedNetwork": false, "fileRead": [], "fileWrite": [], "dangerous": false, "httpServer": false, "ipc": [] },
    "readme": "README.md", "assets": [], "store": { "category": "examples", "icon": "", "banner": "", "screenshots": [] }
  }
}
